<?xml version="1.0" encoding="utf-8"?>
<xs:schema xmlns:xs="http://www.w3.org/2001/XMLSchema">
  <xs:element name="rooms">
    <xs:complexType>
      <xs:sequence>
        <xs:element name="room" minOccurs="1" maxOccurs="unbounded">
          <xs:complexType>
            <xs:sequence>
              <xs:element name="location" minOccurs="1" maxOccurs="1"/>
              <xs:element name="name" minOccurs="1" maxOccurs="1"/>
              <xs:element name="descriptions" minOccurs="1" maxOccurs="1"/>
              <xs:element name="valid_directions" minOccurs="1" maxOccurs="1">
                <xs:complexType>
                  <xs:sequence>
                    <xs:element name="up" maxOccurs="unbounded">
                      <xs:complexType>
                        <xs:simpleContent>
                          <xs:extension base="xs:string">
                            <xs:attribute name="door" use="required"/>
                          </xs:extension>
                        </xs:simpleContent>
                      </xs:complexType>
                    </xs:element>
                    <xs:element name="down" maxOccurs="unbounded">
                      <xs:complexType>
                        <xs:simpleContent>
                          <xs:extension base="xs:string">
                            <xs:attribute name="door" use="required"/>
                          </xs:extension>
                        </xs:simpleContent>
                      </xs:complexType>
                    </xs:element>
                    <xs:element name="left" maxOccurs="unbounded">
                      <xs:complexType>
                        <xs:simpleContent>
                          <xs:extension base="xs:string">
                            <xs:attribute name="door" use="required"/>
                          </xs:extension>
                        </xs:simpleContent>
                      </xs:complexType>
                    </xs:element>
                    <xs:element name="right" maxOccurs="unbounded">
                      <xs:complexType>
                        <xs:simpleContent>
                          <xs:extension base="xs:string">
                            <xs:attribute name="door" use="required"/>
                          </xs:extension>
                        </xs:simpleContent>
                      </xs:complexType>
                    </xs:element>
                  </xs:sequence>
                </xs:complexType>
              </xs:element>
            </xs:sequence>
          </xs:complexType>
        </xs:element>
        <xs:element name="doors" minOccurs ="1" maxOccurs="1">
          <xs:complexType>
            <xs:sequence>
              <xs:element name="door" minOccurs="1" maxOccurs="unbounded">
                <xs:complexType>
                  <xs:sequence>
                    <xs:element name="name" minOccurs="0"/>
                    <xs:element name="state" minOccurs="0" maxOccurs="unbounded">
                      <xs:complexType>
                        <xs:sequence>
                          <xs:element name="output" minOccurs="0" maxOccurs="unbounded">
                            <xs:complexType>
                              <xs:simpleContent>
                                <xs:extension base="xs:string">
                                  <xs:attribute name="input">
                                    <xs:simpleType>
                                      <xs:restriction base="xs:string">
                                        <xs:enumeration value="examine"/>
                                        <xs:enumeration value="unlock"/>
                                        <xs:enumeration value="open"/>
                                        <xs:enumeration value="force"/>
                                      </xs:restriction>
                                    </xs:simpleType>
                                  </xs:attribute>
                                  <xs:attribute name="change_s">
                                    <xs:simpleType>
                                      <xs:restriction base="xs:string">
                                        <xs:enumeration value="True"/>
                                        <xs:enumeration value="False"/>
                                      </xs:restriction>
                                    </xs:simpleType>
                                  </xs:attribute>
                                  <xs:attribute name="key" type ="xs:string"></xs:attribute>
                                </xs:extension>
                              </xs:simpleContent>
                            </xs:complexType>
                          </xs:element>
                        </xs:sequence>
                        <xs:attribute name="s" type="xs:integer"></xs:attribute>
                      </xs:complexType>
                    </xs:element>
                  </xs:sequence>
                  <xs:attribute name="id" type="xs:string" use="required"/>
                  <xs:attribute name="ini_state" type="xs:integer" use="required"/>
                </xs:complexType>
              </xs:element>
            </xs:sequence>
          </xs:complexType>
        </xs:element>
        <xs:element name="objects" minOccurs ="1" maxOccurs="1">
          <xs:complexType>
            <xs:sequence>
              <xs:element name="object" minOccurs="1" maxOccurs="unbounded">
                <xs:complexType>
                  <xs:sequence>
                    <xs:element name="name" minOccurs="1" maxOccurs="1"/>
                    <xs:element name="state" minOccurs ="1" maxOccurs="unbounded">
                      <xs:complexType>
                        <xs:sequence>
                          <xs:element name="output" minOccurs="0" maxOccurs="unbounded">
                            <xs:complexType>
                              <xs:simpleContent>
                                <xs:extension base="xs:string">
                                  <xs:attribute name="input">
                                    <xs:simpleType>
                                      <xs:restriction base="xs:string">
                                        <xs:enumeration value="examine"/>
                                        <xs:enumeration value="unlock"/>
                                        <xs:enumeration value="open"/>
                                        <xs:enumeration value="feed"/>
                                        <xs:enumeration value="take"/>
                                        <xs:enumeration value="move"/>
                                        <xs:enumeration value="pet"/>
                                        <xs:enumeration value="read"/>
                                        <xs:enumeration value="solve"/>
                                      </xs:restriction>
                                    </xs:simpleType>
                                  </xs:attribute>
                                  <xs:attribute name="change_s">
                                    <xs:simpleType>
                                      <xs:restriction base="xs:string">
                                        <xs:enumeration value="True"/>
                                        <xs:enumeration value="False"/>
                                      </xs:restriction>
                                    </xs:simpleType>
                                  </xs:attribute>
                                  <xs:attribute name="key" type="xs:string"></xs:attribute>
                                  <xs:attribute name="solution" type="xs:string"></xs:attribute>
                                  <xs:attribute name="trigger_i" type="xs:string"></xs:attribute>
                                  <xs:attribute name="trigger_o" type="xs:string"></xs:attribute>
                                  <xs:attribute name="change_r" type="xs:string"></xs:attribute>
                                </xs:extension>
                              </xs:simpleContent>
                            </xs:complexType>
                          </xs:element>
                        </xs:sequence>
                        <xs:attribute name="s" type="xs:integer"></xs:attribute>
                      </xs:complexType>
                    </xs:element>
                  </xs:sequence>
                  <xs:attribute name="id" type="xs:string"></xs:attribute>
                </xs:complexType>
              </xs:element>
            </xs:sequence>
          </xs:complexType>
        </xs:element>
      </xs:sequence>
    </xs:complexType>
  </xs:element>
</xs:schema>
